Source,Title,DOI,Citations,Unique ID,Link
PubMed,The Evolution of Automated Medical Billing With Artificial Intelligence: A Review With a Global and Saudi Perspective.,10.7759/cureus.96464,N/A,41384167,https://pubmed.ncbi.nlm.nih.gov/41384167/
PubMed,Artificial intelligence for epilepsy decision support.,10.1111/epi.18709,N/A,41269050,https://pubmed.ncbi.nlm.nih.gov/41269050/
PubMed,A digital twin model for grain enterprise financial shared service centers based on distributed deep learning and neural symbolic reasoning.,10.1038/s41598-025-24350-8 [pii],N/A,41254019,https://pubmed.ncbi.nlm.nih.gov/41254019/
PubMed,Artificial intelligence in blood donor management: A narrative review.,10.1111/vox.70141,N/A,41153019,https://pubmed.ncbi.nlm.nih.gov/41153019/
PubMed,Current Trends and Future Opportunities of AI-Based Analysis in Mesenchymal Stem Cell Imaging: A Scoping Review.,jimaging11100371 [pii],N/A,41150047,https://pubmed.ncbi.nlm.nih.gov/41150047/
PubMed,"AI in Dentistry: Innovations, Ethical Considerations, and Integration Barriers.",bioengineering12090928 [pii],N/A,41007172,https://pubmed.ncbi.nlm.nih.gov/41007172/
PubMed,Artificial intelligence in headache medicine: between automation and the doctor-patient relationship. A systematic review.,10.1186/s10194-025-02143-8 [pii],N/A,40898015,https://pubmed.ncbi.nlm.nih.gov/40898015/
PubMed,Artificial Intelligence Applications in Healthcare: A Systematic Review of Their Impact on Nursing Practice and Patient Outcomes.,10.1111/jnu.70040,N/A,40836587,https://pubmed.ncbi.nlm.nih.gov/40836587/
PubMed,Artificial Intelligence and Machine Learning to Improve Evidence Synthesis Production Efficiency: An Observational Study of Resource Use and Time-to-Completion.,CESM70030 [pii],N/A,40656445,https://pubmed.ncbi.nlm.nih.gov/40656445/
PubMed,Leadership in radiology in the era of technological advancements and artificial intelligence.,10.1007/s00330-025-11745-4 [pii],N/A,40579558,https://pubmed.ncbi.nlm.nih.gov/40579558/
PubMed,Exploring Opportunities and Challenges of AI in Primary Healthcare: A Qualitative Study with Family Doctors in Lithuania.,healthcare13121429 [pii],N/A,40565456,https://pubmed.ncbi.nlm.nih.gov/40565456/
PubMed,Navigating artificial intelligence in home healthcare: challenges and opportunities in nursing wound care.,10.1186/s12912-025-03348-7 [pii],N/A,40537760,https://pubmed.ncbi.nlm.nih.gov/40537760/
PubMed,Artificial Intelligence in Value-Based Health Care.,10.1177_15563316251340074 [pii],N/A,40454290,https://pubmed.ncbi.nlm.nih.gov/40454290/
PubMed,"Artificial Intelligence in Dermatology: A Comprehensive Review of Approved Applications, Clinical Implementation, and Future Directions.",10.1111/ijd.17847,N/A,40387622,https://pubmed.ncbi.nlm.nih.gov/40387622/
PubMed,Generative Artificial Intelligence and Musculoskeletal Health Care.,10.1177_15563316251335334 [pii],N/A,40297632,https://pubmed.ncbi.nlm.nih.gov/40297632/
PubMed,Artificial intelligence in nursing: an integrative review of clinical and operational impacts.,10.3389/fdgth.2025.1552372,N/A,40124108,https://pubmed.ncbi.nlm.nih.gov/40124108/
PubMed,Generative Artificial Intelligence in Academic Surgery: Ethical Implications and Transformative Potential.,S0022-4804(25)00021-6 [pii],N/A,39934059,https://pubmed.ncbi.nlm.nih.gov/39934059/
PubMed,Artificial Intelligence in Dentistry: A Descriptive Review.,bioengineering11121267 [pii],N/A,39768085,https://pubmed.ncbi.nlm.nih.gov/39768085/
PubMed,[The use of artificial intelligence in modern dentistry in the Russian Federation].,10.17116/stomat202410305142,N/A,39436248,https://pubmed.ncbi.nlm.nih.gov/39436248/
PubMed,Increasing Trends of Artificial Intelligence With Robotic Process Automation in Health Care: A Narrative Review.,10.7759/cureus.69680,N/A,39429258,https://pubmed.ncbi.nlm.nih.gov/39429258/
PubMed,"Applications of ChatGPT in the diagnosis, management, education, and research of retinal diseases: a scoping review.",10.1186/s40942-024-00595-9 [pii],N/A,39420407,https://pubmed.ncbi.nlm.nih.gov/39420407/
PubMed,The Medicine Revolution Through Artificial Intelligence: Ethical Challenges of Machine Learning Algorithms in Decision-Making.,10.7759/cureus.69405,N/A,39411643,https://pubmed.ncbi.nlm.nih.gov/39411643/
PubMed,Transforming Prosthodontics and oral implantology using robotics and artificial intelligence.,10.3389/froh.2024.1442100,N/A,39135907,https://pubmed.ncbi.nlm.nih.gov/39135907/
PubMed,"A systematic review of collaborative robots for nurses: where are we now, and where is the evidence?",1398140 [pii],N/A,38899066,https://pubmed.ncbi.nlm.nih.gov/38899066/
PubMed,The Role of Large Language Models in Transforming Emergency Medicine: Scoping Review.,v12i1e53787 [pii],N/A,38728687,https://pubmed.ncbi.nlm.nih.gov/38728687/
PubMed,Can GPT-4 revolutionize otolaryngology? Navigating opportunities and ethical considerations.,S0196-0709(24)00089-9 [pii],N/A,38678799,https://pubmed.ncbi.nlm.nih.gov/38678799/
PubMed,Role of Artificial Intelligence in Global Surgery: A Review of Opportunities and Challenges.,10.7759/cureus.43192,N/A,37692604,https://pubmed.ncbi.nlm.nih.gov/37692604/
PubMed,Current and potential applications of artificial intelligence in medical imaging practice: A narrative review.,S1939-8654(23)00079-6 [pii],N/A,37062603,https://pubmed.ncbi.nlm.nih.gov/37062603/
PubMed,Artificial Intelligence and Machine Learning Based Intervention in Medical Infrastructure: A Review and Future Trends.,healthcare11020207 [pii],N/A,36673575,https://pubmed.ncbi.nlm.nih.gov/36673575/
PubMed,Machine learning in general practice: scoping review of administrative task support and automation.,10.1186/s12875-023-01969-y [pii],N/A,36641467,https://pubmed.ncbi.nlm.nih.gov/36641467/
PubMed,A survey of AI ethics in business literature: Maps and trends between 2000 and 2021.,10.3389/fpsyg.2022.1042661,N/A,36600712,https://pubmed.ncbi.nlm.nih.gov/36600712/
PubMed,Deploying digitalisation and artificial intelligence in sustainable development research.,2252 [pii],N/A,35313685,https://pubmed.ncbi.nlm.nih.gov/35313685/
PubMed,Artificial intelligence and diabetes technology: A review.,S0026-0495(21)00172-4 [pii],N/A,34480920,https://pubmed.ncbi.nlm.nih.gov/34480920/
PubMed,Artificial intelligence and cardiac surgery during COVID-19 era.,JOCS15417 [pii],N/A,33567126,https://pubmed.ncbi.nlm.nih.gov/33567126/
PubMed,Time-saving impact of an algorithm to identify potential surgical site infections.,S0195941700033981 [pii],N/A,24018927,https://pubmed.ncbi.nlm.nih.gov/24018927/
Scopus,Decoding AI innovation: How R&D alliances drive technological breakthrough,10.1016/j.techsoc.2025.103165,1,2-s2.0-105022847962,https://www.scopus.com/record/display.uri?eid=2-s2.0-105022847962&origin=resultslist
Scopus,Research on the automation of intelligent accounting information processing process driven by neural networks,10.1038/s41598-025-31005-1,0,2-s2.0-105027336384,https://www.scopus.com/record/display.uri?eid=2-s2.0-105027336384&origin=resultslist
Scopus,Social and technical enablers of AI integration: Implications for innovative workplace behavior in the UAE,10.5267/j.ijdns.2025.10.010,0,2-s2.0-105026497267,https://www.scopus.com/record/display.uri?eid=2-s2.0-105026497267&origin=resultslist
Scopus,Willingness to buy at AI powered retail stores in Saudi Arabia: Empirical study,10.1007/s12525-025-00865-w,0,2-s2.0-105026367739,https://www.scopus.com/record/display.uri?eid=2-s2.0-105026367739&origin=resultslist
Scopus,"Attitudes Toward AI-powered Robots in Policing: AI Literacy, Organizational Justice, and Occupational Wellbeing Among Chinese Police Officers",10.1007/s11417-025-09478-w,0,2-s2.0-105023496577,https://www.scopus.com/record/display.uri?eid=2-s2.0-105023496577&origin=resultslist
Scopus,"Global bibliometric analysis of molecular imaging-guided robotic-assisted surgery: publication dynamics, thematic evolution, authorship patterns, and disciplinary landscape development (1982–2025)",10.1007/s11701-025-03039-0,0,2-s2.0-105024620306,https://www.scopus.com/record/display.uri?eid=2-s2.0-105024620306&origin=resultslist
Scopus,"Generative artificial intelligence heuristic cues, trust and continuous intention of CBeC platform and the moderating role of information overload",10.1038/s41598-025-32935-6,0,2-s2.0-105028499594,https://www.scopus.com/record/display.uri?eid=2-s2.0-105028499594&origin=resultslist
Scopus,Exploring the future of coaching team flow dynamics through the use of new technologies,10.1007/s44202-025-00531-4,0,2-s2.0-105028456329,https://www.scopus.com/record/display.uri?eid=2-s2.0-105028456329&origin=resultslist
Scopus,Source code vulnerability detection based on deep learning: a review,10.1186/s42400-025-00518-7,0,2-s2.0-105026444094,https://www.scopus.com/record/display.uri?eid=2-s2.0-105026444094&origin=resultslist
Scopus,An empirical evaluation of clustering processes for early detection of university dropout,10.1007/s41060-025-00965-y,0,2-s2.0-105027640513,https://www.scopus.com/record/display.uri?eid=2-s2.0-105027640513&origin=resultslist
Scopus,"Mapping the growth of robotic neurosurgery research: Insights from more than 5,000 publications and 100 top-cited papers",10.1007/s11701-025-03048-z,0,2-s2.0-105024753535,https://www.scopus.com/record/display.uri?eid=2-s2.0-105024753535&origin=resultslist
Scopus,Financial risk identification and prevention system based on random forest algorithm,10.1007/s44163-025-00656-4,0,2-s2.0-105027934728,https://www.scopus.com/record/display.uri?eid=2-s2.0-105027934728&origin=resultslist
Scopus,Hybrid real-synthetic dataset framework for robotic hazard detection in industrial environments,10.1038/s41598-025-33603-5,0,2-s2.0-105027347424,https://www.scopus.com/record/display.uri?eid=2-s2.0-105027347424&origin=resultslist
Scopus,Smart decision engine for performance optimization in enterprise management,10.1038/s41598-025-32966-z,0,2-s2.0-105028439924,https://www.scopus.com/record/display.uri?eid=2-s2.0-105028439924&origin=resultslist
Scopus,Securing financial transactions: exploring the role of lightweight blockchain-enabled deep learning for fraud detection in FinTech systems,10.1186/s42400-025-00436-8,0,2-s2.0-105026857084,https://www.scopus.com/record/display.uri?eid=2-s2.0-105026857084&origin=resultslist
Scopus,Using gradient boosting regression trees to identify cost drivers of laparoscopic surgery in elderly patients,10.1007/s44163-025-00702-1,0,2-s2.0-105027418844,https://www.scopus.com/record/display.uri?eid=2-s2.0-105027418844&origin=resultslist
Scopus,Predicting virtual goods purchases in Vietnam’s MMOGs with a TAM-PERVAL model using PLS-SEM and ANN,10.1057/s41599-025-06379-2,0,2-s2.0-105027689372,https://www.scopus.com/record/display.uri?eid=2-s2.0-105027689372&origin=resultslist
Scopus,Trends and Developments in the Realm of Virtual Forest Visualization,10.1007/s40725-025-00265-5,0,2-s2.0-105027678802,https://www.scopus.com/record/display.uri?eid=2-s2.0-105027678802&origin=resultslist
Scopus,Multidimensional disparities in urban liveability across Chinese non-core cities: a typological exploration based on carbon emissions differences,10.1057/s41599-025-06380-9,0,2-s2.0-105027641716,https://www.scopus.com/record/display.uri?eid=2-s2.0-105027641716&origin=resultslist
Scopus,Examining the Sustainable Integration of Artificial Intelligence in Human Resource Digitalization in the Context of Industry 4.0,10.31637/epsir-2026-2044,0,2-s2.0-105018763011,https://www.scopus.com/record/display.uri?eid=2-s2.0-105018763011&origin=resultslist
Scopus,A bibliometric analysis of RPA and AI research: Current trends and future directions,10.31893/multiscience.2026xxx,0,2-s2.0-105014875364,https://www.scopus.com/record/display.uri?eid=2-s2.0-105014875364&origin=resultslist
Scopus,Leveraging artificial intelligence for intelligent student support: An AI-enabled SRM framework for higher education,10.31893/multiscience.2026160,0,2-s2.0-105014883667,https://www.scopus.com/record/display.uri?eid=2-s2.0-105014883667&origin=resultslist
Scopus,The evolution of accountancy research: A systematic literature review of trends from 1995 to 2025,10.31893/multirev.2026329,0,2-s2.0-105027589107,https://www.scopus.com/record/display.uri?eid=2-s2.0-105027589107&origin=resultslist
Scopus,Colloquial engagement theory with AI awareness (CET-AIA): A new creative pedagogical framework for ethical assessment in the age of artificial intelligence,10.1016/j.tsc.2025.102051,0,2-s2.0-105021129998,https://www.scopus.com/record/display.uri?eid=2-s2.0-105021129998&origin=resultslist
Scopus,AI transformation in working life: A systematic review of usage and attitudes towards AI among workers,10.1016/j.digbus.2025.100162,0,2-s2.0-105026775602,https://www.scopus.com/record/display.uri?eid=2-s2.0-105026775602&origin=resultslist
